{
  "$schema": "https://json-schema.org/draft/2020-12/schema",
  "$id": "board-manager-unit-history.schema.json",
  "title": "Board Manager Unit History",
  "type": "object",
  "required": ["generatedAt", "host", "units", "families", "conflicts"],
  "properties": {
    "generatedAt": { "type": "string" },
    "host": {
      "type": "object",
      "required": ["platform"],
      "properties": {
        "platform": { "type": "string" },
        "hostname": { "type": "string" }
      }
    },
    "units": {
      "type": "array",
      "items": {
        "type": "object",
        "required": ["stableKey", "firstSeenAt", "lastSeenAt", "seenCount", "familyKey", "identity"],
        "properties": {
          "stableKey": { "type": "string" },
          "firstSeenAt": { "type": "string" },
          "lastSeenAt": { "type": "string" },
          "lastPresentAt": { "type": ["string", "null"] },
          "lastMissingAt": { "type": ["string", "null"] },
          "present": { "type": "boolean" },
          "missingCount": { "type": "integer" },
          "seenCount": { "type": "integer" },
          "familyKey": { "type": "string" },
          "profileId": { "type": ["string", "null"] },
          "boardIds": { "type": "array", "items": { "type": "string" } },
          "identity": { "type": "object" },
          "annotation": { "type": "object" },
          "manualOverride": { "type": "object" },
          "transitions": { "type": "object" },
          "metadataHistory": {
            "type": "object",
            "properties": {
              "owners": { "type": "array", "items": { "type": "string" } },
              "locations": { "type": "array", "items": { "type": "string" } },
              "purposes": { "type": "array", "items": { "type": "string" } },
              "firstUpdatedAt": { "type": ["string", "null"] },
              "lastUpdatedAt": { "type": ["string", "null"] },
              "entries": {
                "type": "array",
                "items": {
                  "type": "object",
                  "properties": {
                    "updatedAt": { "type": "string" },
                    "owner": { "type": ["string", "null"] },
                    "location": { "type": ["string", "null"] },
                    "purpose": { "type": ["string", "null"] }
                  }
                }
              }
            }
          },
          "lastTransport": { "type": "object" },
          "observed": { "type": "object" }
        }
      }
    },
    "families": {
      "type": "array",
      "items": {
        "type": "object",
        "required": ["familyKey", "firstSeenAt", "lastSeenAt", "seenCount", "status"],
        "properties": {
          "familyKey": { "type": "string" },
          "firstSeenAt": { "type": "string" },
          "lastSeenAt": { "type": "string" },
          "lastPresentAt": { "type": ["string", "null"] },
          "lastMissingAt": { "type": ["string", "null"] },
          "present": { "type": "boolean" },
          "presentUnitCount": { "type": "integer" },
          "missingUnitCount": { "type": "integer" },
          "seenCount": { "type": "integer" },
          "status": { "type": "string" },
          "profileId": { "type": ["string", "null"] },
          "boardIds": { "type": "array", "items": { "type": "string" } },
          "sampleUnitIds": { "type": "array", "items": { "type": "string" } },
          "transitions": { "type": "object" },
          "fingerprint": { "type": "object" }
        }
      }
    },
    "conflicts": {
      "type": "array",
      "items": {
        "type": "object",
        "required": ["conflictId", "kind", "status", "firstSeenAt", "lastSeenAt", "count", "candidateStableKeys"],
        "properties": {
          "conflictId": { "type": "string" },
          "kind": { "type": "string" },
          "status": { "type": "string" },
          "firstSeenAt": { "type": "string" },
          "lastSeenAt": { "type": "string" },
          "lastResolvedAt": { "type": ["string", "null"] },
          "count": { "type": "integer" },
          "chosenStableKey": { "type": ["string", "null"] },
          "candidateStableKeys": { "type": "array", "items": { "type": "string" } },
          "evidence": { "type": "object" },
          "matches": { "type": "array" },
          "summary": { "type": ["string", "null"] }
        }
      }
    }
  }
}
