{
  "generatedAt": "2026-03-29T21:46:30.715Z",
  "host": {
    "platform": "windows",
    "hostname": "MSI"
  },
  "units": [
    {
      "stableKey": "mac:48:27:e2:66:b0:04",
      "firstSeenAt": "2026-03-29T13:41:50.532Z",
      "lastSeenAt": "2026-03-29T21:46:30.715Z",
      "lastPresentAt": "2026-03-29T21:46:30.715Z",
      "lastMissingAt": null,
      "present": true,
      "missingCount": 0,
      "seenCount": 40,
      "familyKey": "board:m5stack_cores3_gnss_v1",
      "profileId": "board_m5stack_cores3_gnss_v1",
      "boardIds": [
        "m5stack_cores3_gnss_v1"
      ],
      "identity": {
        "stableKey": "mac:48:27:e2:66:b0:04",
        "usbInstance": "USB\\VID_303A&PID_1001&MI_00\\7&2D2626DF&0&0000",
        "mac": "48:27:e2:66:b0:04",
        "serialNumber": "7&2d2626df&0&0000",
        "aliases": [
          "COM4",
          "USB Serial Device (COM4)"
        ],
        "priorStableKeys": []
      },
      "annotation": {
        "label": null,
        "notes": [],
        "owner": null,
        "location": null,
        "purpose": null,
        "updatedAt": null
      },
      "manualOverride": {
        "boardId": null,
        "familyKey": null,
        "note": null,
        "updatedAt": null
      },
      "metadataHistory": {
        "owners": [],
        "locations": [],
        "purposes": [],
        "firstUpdatedAt": null,
        "lastUpdatedAt": null,
        "entries": []
      },
      "transitions": {
        "firstSeen": {
          "at": "2026-03-29T13:41:50.532Z",
          "state": "discovered"
        },
        "lastSeen": {
          "at": "2026-03-29T21:46:30.715Z",
          "state": "observed"
        },
        "lastPresent": {
          "at": "2026-03-29T21:46:30.715Z",
          "state": "present"
        },
        "lastMissing": null
      },
      "lastTransport": {
        "kind": "serial",
        "port": "COM4",
        "usbInstance": "USB\\VID_303A&PID_1001&MI_00\\7&2D2626DF&0&0000",
        "description": "USB Serial Device",
        "name": "USB Serial Device (COM4)"
      },
      "observed": {
        "vid": "303A",
        "pid": "1001",
        "chips": [
          "ESP32-S3 (QFN56) (revision v0.2)"
        ],
        "firmwareSignatures": [
          "board_manager_cores3_gnss_demo"
        ],
        "firmwareApps": [
          "m5stack_cores3_gnss_demo"
        ],
        "firmwareVersions": [
          "0.1.0-dev"
        ],
        "firmwareBuildIds": [
          "Mar 29 2026 15:44:03",
          "Mar 29 2026 18:22:38"
        ],
        "firmwareBoards": [
          "m5stack_cores3_gnss_v1"
        ],
        "firmwareLines": [
          "BoardManagerFirmware: app=m5stack_cores3_gnss_demo version=0.1.0-dev build=Mar 29 2026 15:44:03 board=m5stack_cores3_gnss_v1",
          "BoardManagerFirmware: app=m5stack_cores3_gnss_demo version=0.1.0-dev build=Mar 29 2026 18:22:38 board=m5stack_cores3_gnss_v1"
        ],
        "agentLines": [
          "BoardManagerAgent: board=m5stack_cores3_gnss_v1 app=m5stack_cores3_gnss_demo version=0.1.0-dev capabilities=audio,battery,bluetooth_le,display,gnss,imu,jtag,rtc,touch,uart,usb,wifi build=Mar 29 2026 18:22:38"
        ],
        "agentCapabilitySets": [
          "audio,battery,bluetooth_le,display,gnss,imu,jtag,rtc,touch,uart,usb,wifi"
        ],
        "usbManufacturers": [
          "Microsoft"
        ],
        "usbProductNames": [
          "USB Serial Device (COM4)"
        ],
        "usbServices": [
          "usbser"
        ],
        "usbRevisions": [
          "0101"
        ],
        "usbContainerIds": [
          "{116bb454-e963-5409-9406-30549791eacc}"
        ],
        "usbLocationInformation": [
          "0000.0014.0000.005.003.000.000.000.000"
        ],
        "usbBaseIdentities": [
          "USB\\VID_303A&PID_1001&MI_00\\7&2d2626df&0&0000"
        ],
        "usbBaseSerialNumbers": [
          "7&2d2626df&0&0000"
        ],
        "usbParentIdPrefixes": [],
        "usbEnumeratorNames": [],
        "usbClassNames": [],
        "usbDrivers": [
          "{4d36e978-e325-11ce-bfc1-08002be10318}\\0001"
        ],
        "usbTopologyPaths": [
          "0000.0014.0000.005.003.000.000.000.000",
          "0014/005/003/000/000/000/000"
        ],
        "usbTopologyKinds": [
          "path-segments",
          "raw"
        ],
        "usbFunctionNames": [],
        "rawSignatureLines": [
          "Board Manager CoreS3 GNSS bring-up starting"
        ]
      }
    },
    {
      "stableKey": "mac:c0:4e:30:12:b3:e0",
      "firstSeenAt": "2026-03-29T13:41:50.532Z",
      "lastSeenAt": "2026-03-29T21:46:30.715Z",
      "lastPresentAt": "2026-03-29T21:46:30.715Z",
      "lastMissingAt": null,
      "present": true,
      "missingCount": 0,
      "seenCount": 40,
      "familyKey": "board:m5stack_dial_v1_1",
      "profileId": "board_m5stack_dial_v1_1",
      "boardIds": [
        "m5stack_dial_v1_1"
      ],
      "identity": {
        "stableKey": "mac:c0:4e:30:12:b3:e0",
        "usbInstance": "USB\\VID_303A&PID_1001&MI_00\\7&39B40148&0&0000",
        "mac": "c0:4e:30:12:b3:e0",
        "serialNumber": "7&39b40148&0&0000",
        "aliases": [
          "COM5",
          "USB Serial Device (COM5)"
        ],
        "priorStableKeys": []
      },
      "annotation": {
        "label": null,
        "notes": [],
        "owner": null,
        "location": null,
        "purpose": null,
        "updatedAt": null
      },
      "manualOverride": {
        "boardId": null,
        "familyKey": null,
        "note": null,
        "updatedAt": null
      },
      "metadataHistory": {
        "owners": [],
        "locations": [],
        "purposes": [],
        "firstUpdatedAt": null,
        "lastUpdatedAt": null,
        "entries": []
      },
      "transitions": {
        "firstSeen": {
          "at": "2026-03-29T13:41:50.532Z",
          "state": "discovered"
        },
        "lastSeen": {
          "at": "2026-03-29T21:46:30.715Z",
          "state": "observed"
        },
        "lastPresent": {
          "at": "2026-03-29T21:46:30.715Z",
          "state": "present"
        },
        "lastMissing": null
      },
      "lastTransport": {
        "kind": "serial",
        "port": "COM5",
        "usbInstance": "USB\\VID_303A&PID_1001&MI_00\\7&39B40148&0&0000",
        "description": "USB Serial Device",
        "name": "USB Serial Device (COM5)"
      },
      "observed": {
        "vid": "303A",
        "pid": "1001",
        "chips": [
          "ESP32-S3 (QFN56) (revision v0.2)"
        ],
        "firmwareSignatures": [
          "board_manager_dial_smoketest"
        ],
        "firmwareApps": [
          "m5stack_dial_demo"
        ],
        "firmwareVersions": [
          "0.1.0-dev"
        ],
        "firmwareBuildIds": [
          "Mar 29 2026 15:44:03",
          "Mar 29 2026 18:22:10"
        ],
        "firmwareBoards": [
          "m5stack_dial_v1_1"
        ],
        "firmwareLines": [
          "BoardManagerFirmware: app=m5stack_dial_demo version=0.1.0-dev build=Mar 29 2026 15:44:03 board=m5stack_dial_v1_1",
          "BoardManagerFirmware: app=m5stack_dial_demo version=0.1.0-dev build=Mar 29 2026 18:22:10 board=m5stack_dial_v1_1"
        ],
        "agentLines": [
          "BoardManagerAgent: board=m5stack_dial_v1_1 app=m5stack_dial_demo version=0.1.0-dev capabilities=display,rfid,rotaryEncoder,rtc,touch,usb,wifi build=Mar 29 2026 18:22:10"
        ],
        "agentCapabilitySets": [
          "display,rfid,rotaryEncoder,rtc,touch,usb,wifi"
        ],
        "usbManufacturers": [
          "Microsoft"
        ],
        "usbProductNames": [
          "USB Serial Device (COM5)"
        ],
        "usbServices": [
          "usbser"
        ],
        "usbRevisions": [
          "0101"
        ],
        "usbContainerIds": [
          "{4e9caef0-0f32-5b9a-b1f5-75ca74184f85}"
        ],
        "usbLocationInformation": [
          "0000.0014.0000.005.002.000.000.000.000"
        ],
        "usbBaseIdentities": [
          "USB\\VID_303A&PID_1001&MI_00\\7&39b40148&0&0000"
        ],
        "usbBaseSerialNumbers": [
          "7&39b40148&0&0000"
        ],
        "usbParentIdPrefixes": [],
        "usbEnumeratorNames": [],
        "usbClassNames": [],
        "usbDrivers": [
          "{4d36e978-e325-11ce-bfc1-08002be10318}\\0002"
        ],
        "usbTopologyPaths": [
          "0000.0014.0000.005.002.000.000.000.000",
          "0014/005/002/000/000/000/000"
        ],
        "usbTopologyKinds": [
          "path-segments",
          "raw"
        ],
        "usbFunctionNames": [],
        "rawSignatureLines": [
          "Board Manager dial smoke test starting"
        ]
      }
    },
    {
      "stableKey": "mac:c0:4e:30:13:2b:68",
      "firstSeenAt": "2026-03-29T13:41:50.532Z",
      "lastSeenAt": "2026-03-29T21:46:30.715Z",
      "lastPresentAt": "2026-03-29T21:46:30.715Z",
      "lastMissingAt": null,
      "present": true,
      "missingCount": 0,
      "seenCount": 40,
      "familyKey": "board:m5stack_dial_v1_1",
      "profileId": "board_m5stack_dial_v1_1",
      "boardIds": [
        "m5stack_dial_v1_1"
      ],
      "identity": {
        "stableKey": "mac:c0:4e:30:13:2b:68",
        "usbInstance": "USB\\VID_303A&PID_1001&MI_00\\7&203F6002&0&0000",
        "mac": "c0:4e:30:13:2b:68",
        "serialNumber": "7&203f6002&0&0000",
        "aliases": [
          "COM3",
          "USB Serial Device (COM3)"
        ],
        "priorStableKeys": []
      },
      "annotation": {
        "label": null,
        "notes": [],
        "owner": null,
        "location": null,
        "purpose": null,
        "updatedAt": null
      },
      "manualOverride": {
        "boardId": null,
        "familyKey": null,
        "note": null,
        "updatedAt": null
      },
      "metadataHistory": {
        "owners": [],
        "locations": [],
        "purposes": [],
        "firstUpdatedAt": null,
        "lastUpdatedAt": null,
        "entries": []